{
  "$schema": "https://github.com/AmadeusITGroup/prompt-registry/schemas/lockfile.schema.json",
  "version": "1.0.0",
  "generatedAt": "2025-01-01T00:00:00.000Z",
  "generatedBy": "prompt-registry@1.0.0",
  "bundles": {
    "golden-vscode-bundle": {
      "version": "1.0.0",
      "sourceId": "golden-source",
      "sourceType": "local",
      "installedAt": "2025-01-01T00:00:00.000Z",
      "files": [
        {
          "path": ".github/prompts/review.prompt.md",
          "checksum": "0000000000000000000000000000000000000000000000000000000000000001"
        },
        {
          "path": ".github/instructions/coding.instructions.md",
          "checksum": "0000000000000000000000000000000000000000000000000000000000000002"
        },
        {
          "path": ".github/agents/planner.agent.md",
          "checksum": "0000000000000000000000000000000000000000000000000000000000000003"
        },
        {
          "path": ".github/skills/analyzer/SKILL.md",
          "checksum": "0000000000000000000000000000000000000000000000000000000000000004"
        },
        {
          "path": ".github/skills/analyzer/templates/checklist.md",
          "checksum": "0000000000000000000000000000000000000000000000000000000000000005"
        }
      ]
    }
  },
  "sources": {
    "golden-source": {
      "type": "local",
      "url": "file:///fixtures/golden-source"
    }
  }
}